겨우	1. with difficulty [With much effort.]	아주 힘들게.	ᄀ	브라질 보아 구렁이의 탈출 사건으로 해리는 그 어느 때보다도 긴 벌을 받았다. <font color="#0000ff"><b>[...]</b></font> 벽장에서 다시 나왔을 때는 이미 여름방학이 시작되어 있었다. 그동안에 두들리는 벌써 생일 선물로 받은 새 비디오카메라를 망가뜨렸고, 원격 조종 비행기는 박살 냈으며, 경주용 자전거를 끌고 나가자마자 목발을 짚고 프리벳 가를 건너던 피그 할머니를 치어 넘어뜨렸다.	브라질 보아 구렁이의 탈출 사건으로 해리는 그 어느 때보다도 긴 벌을 받았다. <font color="#0000ff"><b>겨우</b></font> 벽장에서 다시 나왔을 때는 이미 여름방학이 시작되어 있었다. 그동안에 두들리는 벌써 생일 선물로 받은 새 비디오카메라를 망가뜨렸고, 원격 조종 비행기는 박살 냈으며, 경주용 자전거를 끌고 나가자마자 목발을 짚고 프리벳 가를 건너던 피그 할머니를 치어 넘어뜨렸다.	[sound:겨우.mp3]
망가뜨리다	break; destroy [To make something impossible to be used by shattering, smashing, or putting it out of order.]	부수거나 깨거나 또는 고장 나게 해서 완전히 못 쓰게 만들다.	ㅁ	브라질 보아 구렁이의 탈출 사건으로 해리는 그 어느 때보다도 긴 벌을 받았다. 겨우 벽장에서 다시 나왔을 때는 이미 여름방학이 시작되어 있었다. 그동안에 두들리는 벌써 생일 선물로 받은 새 비디오카메라를 <font color="#0000ff"><b>[...]</b></font>, 원격 조종 비행기는 박살 냈으며, 경주용 자전거를 끌고 나가자마자 목발을 짚고 프리벳 가를 건너던 피그 할머니를 치어 넘어뜨렸다.	브라질 보아 구렁이의 탈출 사건으로 해리는 그 어느 때보다도 긴 벌을 받았다. 겨우 벽장에서 다시 나왔을 때는 이미 여름방학이 시작되어 있었다. 그동안에 두들리는 벌써 생일 선물로 받은 새 비디오카메라를 <font color="#0000ff"><b>망가뜨렸고</b></font>, 원격 조종 비행기는 박살 냈으며, 경주용 자전거를 끌고 나가자마자 목발을 짚고 프리벳 가를 건너던 피그 할머니를 치어 넘어뜨렸다.	[sound:망가뜨리다.mp3]
박살	being shattered; being crushed [The state of being shattered and completely broken.]	깨어져 완전히 부서짐.	ㅂ	브라질 보아 구렁이의 탈출 사건으로 해리는 그 어느 때보다도 긴 벌을 받았다. 겨우 벽장에서 다시 나왔을 때는 이미 여름방학이 시작되어 있었다. 그동안에 두들리는 벌써 생일 선물로 받은 새 비디오카메라를 망가뜨렸고, 원격 조종 비행기는 <font color="#0000ff"><b>[...]</b></font> 냈으며, 경주용 자전거를 끌고 나가자마자 목발을 짚고 프리벳 가를 건너던 피그 할머니를 치어 넘어뜨렸다.	브라질 보아 구렁이의 탈출 사건으로 해리는 그 어느 때보다도 긴 벌을 받았다. 겨우 벽장에서 다시 나왔을 때는 이미 여름방학이 시작되어 있었다. 그동안에 두들리는 벌써 생일 선물로 받은 새 비디오카메라를 망가뜨렸고, 원격 조종 비행기는 <font color="#0000ff"><b>박살</b></font> 냈으며, 경주용 자전거를 끌고 나가자마자 목발을 짚고 프리벳 가를 건너던 피그 할머니를 치어 넘어뜨렸다.	[sound:박살.mp3]
목발	crutches [A kind of cane placed under the armpits by a person who has problems with his/her legs to use as support in order to walk.]	다리가 불편한 사람이 겨드랑이에 끼고 걷는 지팡이.	ㅁ	브라질 보아 구렁이의 탈출 사건으로 해리는 그 어느 때보다도 긴 벌을 받았다. 겨우 벽장에서 다시 나왔을 때는 이미 여름방학이 시작되어 있었다. 그동안에 두들리는 벌써 생일 선물로 받은 새 비디오카메라를 망가뜨렸고, 원격 조종 비행기는 박살 냈으며, 경주용 자전거를 끌고 나가자마자 <font color="#0000ff"><b>[...]</b></font>을 짚고 프리벳 가를 건너던 피그 할머니를 치어 넘어뜨렸다.	브라질 보아 구렁이의 탈출 사건으로 해리는 그 어느 때보다도 긴 벌을 받았다. 겨우 벽장에서 다시 나왔을 때는 이미 여름방학이 시작되어 있었다. 그동안에 두들리는 벌써 생일 선물로 받은 새 비디오카메라를 망가뜨렸고, 원격 조종 비행기는 박살 냈으며, 경주용 자전거를 끌고 나가자마자 <font color="#0000ff"><b>목발</b></font>을 짚고 프리벳 가를 건너던 피그 할머니를 치어 넘어뜨렸다.	[sound:목발.mp3]
짚다	1. use; push against [To use the floor, wall, cane, etc. to support one's body.]	바닥이나 벽, 지팡이 등에 몸을 기대어 의지하다.	ㅈ	브라질 보아 구렁이의 탈출 사건으로 해리는 그 어느 때보다도 긴 벌을 받았다. 겨우 벽장에서 다시 나왔을 때는 이미 여름방학이 시작되어 있었다. 그동안에 두들리는 벌써 생일 선물로 받은 새 비디오카메라를 망가뜨렸고, 원격 조종 비행기는 박살 냈으며, 경주용 자전거를 끌고 나가자마자 목발을 <font color="#0000ff"><b>[...]</b></font> 프리벳 가를 건너던 피그 할머니를 치어 넘어뜨렸다.	브라질 보아 구렁이의 탈출 사건으로 해리는 그 어느 때보다도 긴 벌을 받았다. 겨우 벽장에서 다시 나왔을 때는 이미 여름방학이 시작되어 있었다. 그동안에 두들리는 벌써 생일 선물로 받은 새 비디오카메라를 망가뜨렸고, 원격 조종 비행기는 박살 냈으며, 경주용 자전거를 끌고 나가자마자 목발을 <font color="#0000ff"><b>짚고</b></font> 프리벳 가를 건너던 피그 할머니를 치어 넘어뜨렸다.	[sound:짚다.mp3]
치어	fry; fingerling [A very young fish, being hatched not long ago.]	알에서 깬 지 얼마 되지 않은 어린 물고기.	ㅊ	브라질 보아 구렁이의 탈출 사건으로 해리는 그 어느 때보다도 긴 벌을 받았다. 겨우 벽장에서 다시 나왔을 때는 이미 여름방학이 시작되어 있었다. 그동안에 두들리는 벌써 생일 선물로 받은 새 비디오카메라를 망가뜨렸고, 원격 조종 비행기는 박살 냈으며, 경주용 자전거를 끌고 나가자마자 목발을 짚고 프리벳 가를 건너던 피그 할머니를 <font color="#0000ff"><b>[...]</b></font> 넘어뜨렸다.	브라질 보아 구렁이의 탈출 사건으로 해리는 그 어느 때보다도 긴 벌을 받았다. 겨우 벽장에서 다시 나왔을 때는 이미 여름방학이 시작되어 있었다. 그동안에 두들리는 벌써 생일 선물로 받은 새 비디오카메라를 망가뜨렸고, 원격 조종 비행기는 박살 냈으며, 경주용 자전거를 끌고 나가자마자 목발을 짚고 프리벳 가를 건너던 피그 할머니를 <font color="#0000ff"><b>치어</b></font> 넘어뜨렸다.	[sound:치어.mp3]
빠짐없이	everything; all [All without exception.]	하나도 빠뜨리지 않고 다.	ㅃ	해리는 방학이 시작된 게 기쁘기는 했지만, 하루도 <font color="#0000ff"><b>[...]</b></font> 집에 놀러 오는 두들리 패거리를 피할 도리가 없었다. 피어스와 데니스와 말콤 그리고 고든, 모두 하나같이 몸집이 크고 돌머리 였지만, 두들리가 대장이 된 것은 그가 그들 중 몸집이 가장 크고 제일 멍청했기 때문이다. 그 패거리는 모두 두들리가 가장 좋아하는 놀이인 ‘해리 골려 주기’를 무엇보다 좋아했다.	해리는 방학이 시작된 게 기쁘기는 했지만, 하루도 <font color="#0000ff"><b>빠짐없이</b></font> 집에 놀러 오는 두들리 패거리를 피할 도리가 없었다. 피어스와 데니스와 말콤 그리고 고든, 모두 하나같이 몸집이 크고 돌머리 였지만, 두들리가 대장이 된 것은 그가 그들 중 몸집이 가장 크고 제일 멍청했기 때문이다. 그 패거리는 모두 두들리가 가장 좋아하는 놀이인 ‘해리 골려 주기’를 무엇보다 좋아했다.	[sound:빠짐없이.mp3]
골리다	play a joke on; play a trick on [To make someone angry by teasing him/her.]	놀려서 화나게 하다.	ᄀ	해리는 방학이 시작된 게 기쁘기는 했지만, 하루도 빠짐없이 집에 놀러 오는 두들리 패거리를 피할 도리가 없었다. 피어스와 데니스와 말콤 그리고 고든, 모두 하나같이 몸집이 크고 돌머리 였지만, 두들리가 대장이 된 것은 그가 그들 중 몸집이 가장 크고 제일 멍청했기 때문이다. 그 패거리는 모두 두들리가 가장 좋아하는 놀이인 ‘해리 <font color="#0000ff"><b>[...]</b></font> 주기’를 무엇보다 좋아했다.	해리는 방학이 시작된 게 기쁘기는 했지만, 하루도 빠짐없이 집에 놀러 오는 두들리 패거리를 피할 도리가 없었다. 피어스와 데니스와 말콤 그리고 고든, 모두 하나같이 몸집이 크고 돌머리 였지만, 두들리가 대장이 된 것은 그가 그들 중 몸집이 가장 크고 제일 멍청했기 때문이다. 그 패거리는 모두 두들리가 가장 좋아하는 놀이인 ‘해리 <font color="#0000ff"><b>골려</b></font> 주기’를 무엇보다 좋아했다.	[sound:골리다.mp3]